<?xml version="1.0" encoding="utf-8"?>
<HoldInfo xmlns:vc="http://www.w3.org/2007/XMLSchema-versioning" xmlns:xsi="http://www.w3.org/2001/XMLSchema-instance" xsi:noNamespaceSchemaLocation="HoldInfo.xsd">
	<mcc>string</mcc>
	<amount>661.80</amount>
	<itemId>string</itemId>
	<auxData/>
	<currency>A</currency>
	<tradeDate>string</tradeDate>
	<description>string</description>
	<transactionType>string</transactionType>
	<sender>
		<accountMassPayment>string</accountMassPayment>
		<nameAddress>
			<item/>
			<item/>
			<value>
				<item>string</item>
				<item>string</item>
				<item>string</item>
			</value>
		</nameAddress>
		<item/>
		<item/>
		<bank>
			<countryCode>AB</countryCode>
			<item/>
			<item/>
			<item/>
			<item/>
			<name>string</name>
			<address>
				<item>string</item>
				<item>string</item>
				<item>string</item>
				<item>string</item>
			</address>
		</bank>
		<accountNumber>string</accountNumber>
	</sender>
	<initiator>
		<item/>
		<item/>
		<item/>
		<value>
			<item>string</item>
		</value>
	</initiator>
	<recipient>
		<accountMassPayment>string</accountMassPayment>
		<nameAddress>
			<item/>
			<item/>
		</nameAddress>
		<item/>
		<item/>
		<item/>
		<item/>
		<item/>
		<bank>
			<name>string</name>
			<code>string</code>
		</bank>
		<accountNumber>string</accountNumber>
	</recipient>
	<holdExpirationDate>string</holdExpirationDate>
</HoldInfo>
